user,date,rawContent,user_location,verified,followers,created
"{'username': 'VijayMavinkurve', 'id': 3419659035, 'displayname': 'Dr vijay mavinkurve', 'rawDescription': ""VIEWS STRICTLY PERSONAL,RT's NOT ENDORSEMENT....INDIA FIRST"", 'renderedDescription': ""VIEWS STRICTLY PERSONAL,RT's NOT ENDORSEMENT....INDIA FIRST"", 'descriptionLinks': None, 'verified': False, 'created': datetime.datetime(2015, 8, 13, 8, 8, tzinfo=datetime.timezone.utc), 'followersCount': 205, 'friendsCount': 496, 'statusesCount': 22948, 'favouritesCount': 36628, 'listedCount': 4, 'mediaCount': 645, 'location': 'VALSAD, GUJARAT, INDIA', 'protected': False, 'link': None, 'profileImageUrl': 'https://pbs.twimg.com/profile_images/1586728088733294593/rl9Maoy5_normal.jpg', 'profileBannerUrl': 'https://pbs.twimg.com/profile_banners/3419659035/1636932701', 'label': None}",2019-07-15 07:12:38+00:00,"@TheSamirAbbas Yes legal notice may not be a proper remedy but don't you think that your press club who issued the boycott (in other words FATWA) has overreacted to the issue??Actors &amp; journalist alike aren't ""Doodh ke dhule""....Mandwali kar lo.....","VALSAD, GUJARAT, INDIA",False,205,2015-08-13 08:08:00+00:00
"{'username': 'nishaDev1', 'id': 358588814, 'displayname': 'nishaDev1', 'rawDescription': 'Agriculturist and a farmer.. Teacher of Economics, English and History.', 'renderedDescription': 'Agriculturist and a farmer.. Teacher of Economics, English and History.', 'descriptionLinks': None, 'verified': False, 'created': datetime.datetime(2011, 8, 20, 4, 51, 37, tzinfo=datetime.timezone.utc), 'followersCount': 569, 'friendsCount': 388, 'statusesCount': 34122, 'favouritesCount': 33840, 'listedCount': 5, 'mediaCount': 2912, 'location': 'Bangalore', 'protected': False, 'link': {'text': 'nishadev.com', 'url': 'http://nishadev.com', 'tcourl': 'https://t.co/jmtHbwhrJp', 'indices': (0, 23)}, 'profileImageUrl': 'https://pbs.twimg.com/profile_images/459677421789118464/9id0EL-z_normal.jpeg', 'profileBannerUrl': 'https://pbs.twimg.com/profile_banners/358588814/1410170068', 'label': None}",2019-07-15 04:23:53+00:00,"@bainjal Next, the people may  boycott her movies. After, the wonderful Jhansi Ki Rani we don't want to see any more of her movies. We suggest she take a break from all talk and no action. Good luck dear Kangana. Grow up.",Bangalore,False,569,2011-08-20 04:51:37+00:00
"{'username': 'Saikat28', 'id': 100797930, 'displayname': ""Comm'st in School||Secu in College|| Sanatan 4ever"", 'rawDescription': 'तत्परिवर्तनं भव | Be the change\nप्रेम सर्वान्\u200c जयति | Love conquers all', 'renderedDescription': 'तत्परिवर्तनं भव | Be the change\nप्रेम सर्वान्\u200c जयति | Love conquers all', 'descriptionLinks': None, 'verified': False, 'created': datetime.datetime(2009, 12, 31, 16, 25, 10, tzinfo=datetime.timezone.utc), 'followersCount': 165, 'friendsCount': 292, 'statusesCount': 15516, 'favouritesCount': 3481, 'listedCount': 0, 'mediaCount': 1451, 'location': 'India', 'protected': False, 'link': None, 'profileImageUrl': 'https://pbs.twimg.com/profile_images/880495636520476672/RrxtArn1_normal.jpg', 'profileBannerUrl': 'https://pbs.twimg.com/profile_banners/100797930/1566846790', 'label': None}",2019-07-15 03:39:53+00:00,"After kolkata another incident of Muslims attacking Doctors in Lucknow Hospital.

If situation so continues then medical fraternity will be forced to boycott treatment to ALL Muslims. 

Is it a strategy to avoid paying bill after a Muslim patient dies ? 

Enough is Enough !",India,False,165,2009-12-31 16:25:10+00:00
