user,date,rawContent,user_location,verified,followers,created
"{'username': 'flightofsand', 'id': 981857739067609088, 'displayname': 'JayaprakashSatyamurthy@mastodon.social', 'rawDescription': '45. Literary and musical amateur. Professional editor and content writer. Lives w/many cats and dogs & @yasmine_claire', 'renderedDescription': '45. Literary and musical amateur. Professional editor and content writer. Lives w/many cats and dogs & @yasmine_claire', 'descriptionLinks': None, 'verified': False, 'created': datetime.datetime(2018, 4, 5, 11, 35, 1, tzinfo=datetime.timezone.utc), 'followersCount': 3603, 'friendsCount': 4916, 'statusesCount': 65446, 'favouritesCount': 238899, 'listedCount': 23, 'mediaCount': 8698, 'location': 'Bengaluru, India', 'protected': False, 'link': {'text': 'linktr.ee/JayaprakashS', 'url': 'https://linktr.ee/JayaprakashS', 'tcourl': 'https://t.co/IsxJr8x6uF', 'indices': (0, 23)}, 'profileImageUrl': 'https://pbs.twimg.com/profile_images/1591702932604735489/oZgHLz4M_normal.jpg', 'profileBannerUrl': 'https://pbs.twimg.com/profile_banners/981857739067609088/1662428183', 'label': None}",2019-05-12 14:18:25+00:00,"Plebe metalhead: i can separate the art from the creator especially if they're edgy lol
Woke metalhead: i boycott bigots, racists and rapists
Galaxy brain metalhead (me): i will only listen to pirated metal. no nazi gets my dime, even by accident","Bengaluru, India",False,3603,2018-04-05 11:35:01+00:00
"{'username': 'tweet_madhav', 'id': 149080224, 'displayname': 'Madhav R', 'rawDescription': '~#~ Om Namaḥ Śivāya ~#~ జ్ఞానం పరమం బలం Nature, Nation, Self.. in that order! 😊', 'renderedDescription': '~#~ Om Namaḥ Śivāya ~#~ జ్ఞానం పరమం బలం Nature, Nation, Self.. in that order! 😊', 'descriptionLinks': None, 'verified': False, 'created': datetime.datetime(2010, 5, 28, 10, 48, 59, tzinfo=datetime.timezone.utc), 'followersCount': 53, 'friendsCount': 463, 'statusesCount': 3216, 'favouritesCount': 1993, 'listedCount': 2, 'mediaCount': 456, 'location': 'Bengaluru, India', 'protected': False, 'link': None, 'profileImageUrl': 'https://pbs.twimg.com/profile_images/1550667872858681344/LXYAcdr__normal.jpg', 'profileBannerUrl': 'https://pbs.twimg.com/profile_banners/149080224/1556011590', 'label': None}",2019-05-12 02:45:38+00:00,"Yet another write up by a senior journalist about loafer #YellowMedia channel @TV9Telugu!
More and more reasons to boycott it who sell themselves under the mask of #Journalism!!","Bengaluru, India",False,53,2010-05-28 10:48:59+00:00
"{'username': 'mike_captain_7', 'id': 63384435, 'displayname': 'Llewellyn Nyss', 'rawDescription': 'A go-getter, consultant, problem solver, advisor, and an optimistic person. Taking life one step at a time.', 'renderedDescription': 'A go-getter, consultant, problem solver, advisor, and an optimistic person. Taking life one step at a time.', 'descriptionLinks': None, 'verified': False, 'created': datetime.datetime(2009, 8, 6, 5, 38, 43, tzinfo=datetime.timezone.utc), 'followersCount': 187, 'friendsCount': 284, 'statusesCount': 884, 'favouritesCount': 9, 'listedCount': 0, 'mediaCount': 90, 'location': 'Bangalore, IN', 'protected': False, 'link': {'text': 'linkedin.com/in/lmnyss', 'url': 'https://www.linkedin.com/in/lmnyss', 'tcourl': 'https://t.co/OtKyGIuOFB', 'indices': (0, 23)}, 'profileImageUrl': 'https://pbs.twimg.com/profile_images/1002830212726321152/x5XnDlJH_normal.jpg', 'profileBannerUrl': 'https://pbs.twimg.com/profile_banners/63384435/1527928330', 'label': None}",2019-05-11 21:02:57+00:00,"@Olacabs @ola_supports why even provide a service, wherein the driver asks where is the drop location and answers that he will take the double time to come. Thereby forcing me to cancel a ride and be charged 50 bucks. Such pathetic service. Need to #boycott #Ola it seems..","Bangalore, IN",False,187,2009-08-06 05:38:43+00:00
"{'username': 'sohitkumar', 'id': 64364072, 'displayname': 'Sohit Kumar Singh', 'rawDescription': 'Two roads diverged in a yellow wood,And sorry I could not travel both.I have taken the one less traveled by.', 'renderedDescription': 'Two roads diverged in a yellow wood,And sorry I could not travel both.I have taken the one less traveled by.', 'descriptionLinks': None, 'verified': False, 'created': datetime.datetime(2009, 8, 10, 8, 57, 44, tzinfo=datetime.timezone.utc), 'followersCount': 125, 'friendsCount': 550, 'statusesCount': 3107, 'favouritesCount': 6543, 'listedCount': 0, 'mediaCount': 92, 'location': 'Bangalore', 'protected': False, 'link': None, 'profileImageUrl': 'https://pbs.twimg.com/profile_images/1453809609727037441/9LEDayA8_normal.jpg', 'profileBannerUrl': 'https://pbs.twimg.com/profile_banners/64364072/1504013191', 'label': None}",2019-05-11 16:07:42+00:00,Boycott Bollywood.,Bangalore,False,125,2009-08-10 08:57:44+00:00
"{'username': 'Venkat05267392', 'id': 1039045443643031552, 'displayname': 'gundusoodhi', 'rawDescription': '', 'renderedDescription': '', 'descriptionLinks': None, 'verified': False, 'created': datetime.datetime(2018, 9, 10, 6, 58, 33, tzinfo=datetime.timezone.utc), 'followersCount': 61, 'friendsCount': 2677, 'statusesCount': 477, 'favouritesCount': 145, 'listedCount': 0, 'mediaCount': 28, 'location': 'India', 'protected': False, 'link': None, 'profileImageUrl': 'https://pbs.twimg.com/profile_images/1138335644764164096/EnCRtkiX_normal.jpg', 'profileBannerUrl': None, 'label': None}",2019-05-11 15:04:41+00:00,@am_johnny_ @PawanKalyan Tv9 boycott chesindhi doggy eggu lekunda tv9 aa,India,False,61,2018-09-10 06:58:33+00:00
"{'username': 'Sajish_A16', 'id': 3420706731, 'displayname': 'Sajish Vasudevan', 'rawDescription': 'Fan Of Kerala Blasters Fc, Fc Barcelona & Indian Football Team ⚽ ⚽\n...', 'renderedDescription': 'Fan Of Kerala Blasters Fc, Fc Barcelona & Indian Football Team ⚽ ⚽\n...', 'descriptionLinks': None, 'verified': False, 'created': datetime.datetime(2015, 8, 13, 19, 26, 31, tzinfo=datetime.timezone.utc), 'followersCount': 151, 'friendsCount': 241, 'statusesCount': 7928, 'favouritesCount': 24630, 'listedCount': 1, 'mediaCount': 82, 'location': 'Nallasopara, Mumbai, India', 'protected': False, 'link': {'text': 'm.facebook.com/sajish.vasudev…', 'url': 'https://m.facebook.com/sajish.vasudevan.5', 'tcourl': 'https://t.co/AZJPUss3ny', 'indices': (0, 23)}, 'profileImageUrl': 'https://pbs.twimg.com/profile_images/1373290778823327745/AwNbT8hC_normal.jpg', 'profileBannerUrl': 'https://pbs.twimg.com/profile_banners/3420706731/1558316495', 'label': None}",2019-05-11 13:19:30+00:00,"From today onward i will boycott all @akshaykumar movies because he is no more Indian citizen, Now he has too look for job in Hollywood, ""Hamara Vatan Itna Bhi Bura Nahi Hai.""","Nallasopara, Mumbai, India",False,151,2015-08-13 19:26:31+00:00
"{'username': 'shriramfooty', 'id': 783717331251761152, 'displayname': 'Shriram Srinivasan', 'rawDescription': '', 'renderedDescription': '', 'descriptionLinks': None, 'verified': False, 'created': datetime.datetime(2016, 10, 5, 17, 15, 47, tzinfo=datetime.timezone.utc), 'followersCount': 104, 'friendsCount': 716, 'statusesCount': 5527, 'favouritesCount': 1133, 'listedCount': 0, 'mediaCount': 85, 'location': 'Chennai, India', 'protected': False, 'link': None, 'profileImageUrl': 'https://pbs.twimg.com/profile_images/805131404996550656/62JtRkbG_normal.jpg', 'profileBannerUrl': 'https://pbs.twimg.com/profile_banners/783717331251761152/1519602490', 'label': None}",2019-05-11 12:22:02+00:00,"Fuck off newspapers and tabloids.

Full respect to Geoffrey Boycott for not mincing his words and speaking as a true fan","Chennai, India",False,104,2016-10-05 17:15:47+00:00
"{'username': 'TheOnlyBrahma', 'id': 75200537, 'displayname': 'Brahma 🇮🇳', 'rawDescription': 'Indian! A proud Bengalurean', 'renderedDescription': 'Indian! A proud Bengalurean', 'descriptionLinks': None, 'verified': False, 'created': datetime.datetime(2009, 9, 18, 4, 35, 58, tzinfo=datetime.timezone.utc), 'followersCount': 1006, 'friendsCount': 492, 'statusesCount': 38685, 'favouritesCount': 807, 'listedCount': 37, 'mediaCount': 1566, 'location': 'ÜT: 12.91821,77.582161', 'protected': False, 'link': None, 'profileImageUrl': 'https://pbs.twimg.com/profile_images/1559419054183485441/XzgNsSrE_normal.jpg', 'profileBannerUrl': 'https://pbs.twimg.com/profile_banners/75200537/1497614787', 'label': None}",2019-05-11 11:50:40+00:00,@UmarKhalidJNU Khalid Miyan. 23rd ke baad aap kya kya boycott karoge,"ÜT: 12.91821,77.582161",False,1006,2009-09-18 04:35:58+00:00
"{'username': 'AnkushS57314178', 'id': 1021377417850519553, 'displayname': 'Ankush Sharma', 'rawDescription': 'Biologics-Lifestyle-Cricket-Marketing-World Traveller', 'renderedDescription': 'Biologics-Lifestyle-Cricket-Marketing-World Traveller', 'descriptionLinks': None, 'verified': False, 'created': datetime.datetime(2018, 7, 23, 12, 52, 7, tzinfo=datetime.timezone.utc), 'followersCount': 4, 'friendsCount': 32, 'statusesCount': 67, 'favouritesCount': 122, 'listedCount': 0, 'mediaCount': 7, 'location': '', 'protected': False, 'link': None, 'profileImageUrl': 'https://pbs.twimg.com/profile_images/1021378399560925184/wTV3nkws_normal.jpg', 'profileBannerUrl': None, 'label': None}",2019-05-11 10:15:59+00:00,@alpana_chandra @RelianceDigital Very ture..only selling is there job...no customer service #boycott,,False,4,2018-07-23 12:52:07+00:00
"{'username': 'Anil4Joseph', 'id': 1970700716, 'displayname': 'Anil P Joseph', 'rawDescription': 'He who seeds a thought, harvests a destiny. — Zen proverb | | □∧◯. Wannabe Farmer of Ideas,Talent & Dreams...', 'renderedDescription': 'He who seeds a thought, harvests a destiny. — Zen proverb | | □∧◯. Wannabe Farmer of Ideas,Talent & Dreams...', 'descriptionLinks': None, 'verified': False, 'created': datetime.datetime(2013, 10, 19, 7, 14, 18, tzinfo=datetime.timezone.utc), 'followersCount': 695, 'friendsCount': 3087, 'statusesCount': 15572, 'favouritesCount': 18314, 'listedCount': 10, 'mediaCount': 1464, 'location': 'Chennai, Tamil Nadu', 'protected': False, 'link': None, 'profileImageUrl': 'https://pbs.twimg.com/profile_images/1400739245401067520/lL3UI9j2_normal.jpg', 'profileBannerUrl': 'https://pbs.twimg.com/profile_banners/1970700716/1528436970', 'label': None}",2019-05-11 07:43:07+00:00,"@GaneshNatarajan True...

Time has made our PM look like global equivalent of folks like Kanhaiya Kumar...

Time to boycott &amp; ignore publications like Time","Chennai, Tamil Nadu",False,695,2013-10-19 07:14:18+00:00
"{'username': 'ashley_ka_adda', 'id': 1253898560, 'displayname': ""Aron Ashley D'Souza"", 'rawDescription': 'Revolutionist , Deep Interest In Music (Drums)', 'renderedDescription': 'Revolutionist , Deep Interest In Music (Drums)', 'descriptionLinks': None, 'verified': False, 'created': datetime.datetime(2013, 3, 9, 9, 21, 37, tzinfo=datetime.timezone.utc), 'followersCount': 24, 'friendsCount': 33, 'statusesCount': 436, 'favouritesCount': 9912, 'listedCount': 0, 'mediaCount': 31, 'location': 'Mumbai,Maharastra,India', 'protected': False, 'link': None, 'profileImageUrl': 'https://pbs.twimg.com/profile_images/1258851093074735104/Bieye0kS_normal.jpg', 'profileBannerUrl': 'https://pbs.twimg.com/profile_banners/1253898560/1561388625', 'label': None}",2019-05-10 22:04:20+00:00,"@AAPkaSurender In Brar Square , Delhi Cant. People Having Electricity Issues From Nearly 20 Years , People There Have Decided To Boycott Elections , Please Reply What You Are Going To Do On This Issue.","Mumbai,Maharastra,India",False,24,2013-03-09 09:21:37+00:00
"{'username': 'ashley_ka_adda', 'id': 1253898560, 'displayname': ""Aron Ashley D'Souza"", 'rawDescription': 'Revolutionist , Deep Interest In Music (Drums)', 'renderedDescription': 'Revolutionist , Deep Interest In Music (Drums)', 'descriptionLinks': None, 'verified': False, 'created': datetime.datetime(2013, 3, 9, 9, 21, 37, tzinfo=datetime.timezone.utc), 'followersCount': 24, 'friendsCount': 33, 'statusesCount': 436, 'favouritesCount': 9912, 'listedCount': 0, 'mediaCount': 31, 'location': 'Mumbai,Maharastra,India', 'protected': False, 'link': None, 'profileImageUrl': 'https://pbs.twimg.com/profile_images/1258851093074735104/Bieye0kS_normal.jpg', 'profileBannerUrl': 'https://pbs.twimg.com/profile_banners/1253898560/1561388625', 'label': None}",2019-05-10 22:00:56+00:00,"@brijeshgoyalaap In Brar Square , Delhi Cant. People Having Electricity Issues From Nearly 20 Years , People There Have Decided To Boycott Elections , Please Reply What You Are Going To Do On This Issue.","Mumbai,Maharastra,India",False,24,2013-03-09 09:21:37+00:00
"{'username': 'NotaProudIndian', 'id': 26662858, 'displayname': 'Kushal Oswal', 'rawDescription': 'Human ONLY.. family. friends. fifa. sports. drives. music. goa. ambitious. motivated. All of the above in no proper order whatsoever.', 'renderedDescription': 'Human ONLY.. family. friends. fifa. sports. drives. music. goa. ambitious. motivated. All of the above in no proper order whatsoever.', 'descriptionLinks': None, 'verified': False, 'created': datetime.datetime(2009, 3, 26, 2, 10, 51, tzinfo=datetime.timezone.utc), 'followersCount': 148, 'friendsCount': 127, 'statusesCount': 13713, 'favouritesCount': 11107, 'listedCount': 1, 'mediaCount': 315, 'location': 'Pune', 'protected': False, 'link': None, 'profileImageUrl': 'https://pbs.twimg.com/profile_images/1572616411067056128/m_NtZSjF_normal.jpg', 'profileBannerUrl': 'https://pbs.twimg.com/profile_banners/26662858/1591692891', 'label': None}",2019-05-10 19:02:03+00:00,@thevirdas Hoping they will boycott times now &amp; times of India.,Pune,False,148,2009-03-26 02:10:51+00:00
"{'username': 'nimish_fortune', 'id': 718706613406863360, 'displayname': 'Nimish Shah', 'rawDescription': '', 'renderedDescription': '', 'descriptionLinks': None, 'verified': False, 'created': datetime.datetime(2016, 4, 9, 7, 46, 24, tzinfo=datetime.timezone.utc), 'followersCount': 55, 'friendsCount': 81, 'statusesCount': 472, 'favouritesCount': 135, 'listedCount': 0, 'mediaCount': 5, 'location': '', 'protected': False, 'link': None, 'profileImageUrl': 'https://abs.twimg.com/sticky/default_profile_images/default_profile_normal.png', 'profileBannerUrl': None, 'label': None}",2019-05-10 17:26:59+00:00,"@abpnewstv Authored by an India Baiter , boycott Timec",,False,55,2016-04-09 07:46:24+00:00
"{'username': 'AnkushS57314178', 'id': 1021377417850519553, 'displayname': 'Ankush Sharma', 'rawDescription': 'Biologics-Lifestyle-Cricket-Marketing-World Traveller', 'renderedDescription': 'Biologics-Lifestyle-Cricket-Marketing-World Traveller', 'descriptionLinks': None, 'verified': False, 'created': datetime.datetime(2018, 7, 23, 12, 52, 7, tzinfo=datetime.timezone.utc), 'followersCount': 4, 'friendsCount': 32, 'statusesCount': 67, 'favouritesCount': 122, 'listedCount': 0, 'mediaCount': 7, 'location': '', 'protected': False, 'link': None, 'profileImageUrl': 'https://pbs.twimg.com/profile_images/1021378399560925184/wTV3nkws_normal.jpg', 'profileBannerUrl': None, 'label': None}",2019-05-10 14:48:44+00:00,I have shared the same. But No response till date...how pathetic your service is..your teleservice guys everyday say that we have escslated and its on priority..imagine if it was not priority..please close your stores #boycott #patheticservices,,False,4,2018-07-23 12:52:07+00:00
"{'username': 'azherhusain', 'id': 198205392, 'displayname': 'Dr_Azher_Husain', 'rawDescription': 'State Media Co-ordinator, TN @IYC |\nDoctor| Active AIPC member | @INCIndia❤️ follows me| Political Commentator- Strategist | Chess|\n||🇮🇳INDIA first🇮🇳||', 'renderedDescription': 'State Media Co-ordinator, TN @IYC |\nDoctor| Active AIPC member | @INCIndia❤️ follows me| Political Commentator- Strategist | Chess|\n||🇮🇳INDIA first🇮🇳||', 'descriptionLinks': None, 'verified': False, 'created': datetime.datetime(2010, 10, 3, 17, 8, 29, tzinfo=datetime.timezone.utc), 'followersCount': 1752, 'friendsCount': 1603, 'statusesCount': 8762, 'favouritesCount': 5881, 'listedCount': 9, 'mediaCount': 304, 'location': 'Madras, India', 'protected': False, 'link': {'text': 'facebook.com/dr.azherhusain…', 'url': 'https://www.facebook.com/dr.azherhusain41', 'tcourl': 'https://t.co/TIzNvEU38p', 'indices': (0, 23)}, 'profileImageUrl': 'https://pbs.twimg.com/profile_images/1463543896185585667/GmU8pujx_normal.jpg', 'profileBannerUrl': 'https://pbs.twimg.com/profile_banners/198205392/1594158842', 'label': None}",2019-05-10 14:27:09+00:00,"Waiting when Modi Bhakts gonna boycott TIME's 😉
#TimeMagazine

And end up blocking on DTH and giving poor ratings on @GooglePlay  to #TIMESNOW 

Buhahahaha","Madras, India",False,1752,2010-10-03 17:08:29+00:00
"{'username': 'shivatkii', 'id': 624329772, 'displayname': 'N.Shiva', 'rawDescription': 'Desh Bhakt. focused on development of nation. management consultant expert rapid business transformation, M&A , digital workplace and leadership Search', 'renderedDescription': 'Desh Bhakt. focused on development of nation. management consultant expert rapid business transformation, M&A , digital workplace and leadership Search', 'descriptionLinks': None, 'verified': False, 'created': datetime.datetime(2012, 7, 2, 1, 28, 34, tzinfo=datetime.timezone.utc), 'followersCount': 41, 'friendsCount': 438, 'statusesCount': 1782, 'favouritesCount': 1254, 'listedCount': 2, 'mediaCount': 52, 'location': 'Pune, India', 'protected': False, 'link': {'text': 'rembarrier.com', 'url': 'http://www.rembarrier.com', 'tcourl': 'https://t.co/efMYkGSKq7', 'indices': (0, 23)}, 'profileImageUrl': 'https://pbs.twimg.com/profile_images/1556340518765793280/r3nACKZ5_normal.jpg', 'profileBannerUrl': None, 'label': None}",2019-05-10 06:52:12+00:00,@TIME Modi is a challenger to those who have been dividing india for 70 years. India will vote nationalist Modi again to power . Is it sending shivers to those elites of the world ??? It is time to end and boycott TIME  @republic @BJP4India @NaMo4PM @NamoINDIAPM,"Pune, India",False,41,2012-07-02 01:28:34+00:00
"{'username': 'RamaraoVelagap1', 'id': 997486820639297536, 'displayname': 'Ramarao Velagapudi', 'rawDescription': 'Retired bank executive.', 'renderedDescription': 'Retired bank executive.', 'descriptionLinks': None, 'verified': False, 'created': datetime.datetime(2018, 5, 18, 14, 39, 25, tzinfo=datetime.timezone.utc), 'followersCount': 60, 'friendsCount': 435, 'statusesCount': 22029, 'favouritesCount': 33068, 'listedCount': 1, 'mediaCount': 377, 'location': 'Hyderabad, India', 'protected': False, 'link': None, 'profileImageUrl': 'https://abs.twimg.com/sticky/default_profile_images/default_profile_normal.png', 'profileBannerUrl': None, 'label': None}",2019-05-09 22:51:22+00:00,@IndianExpress Ha! Boycott Pak till it vacates PoK,"Hyderabad, India",False,60,2018-05-18 14:39:25+00:00
"{'username': 'bhaarat2029', 'id': 1602372092, 'displayname': 'Bharatiya', 'rawDescription': 'Good Majority Never Rules a Group by LAW. \nBut, Bad Minority Rules That Group of Good Majority by Breaking the LAW.', 'renderedDescription': 'Good Majority Never Rules a Group by LAW. \nBut, Bad Minority Rules That Group of Good Majority by Breaking the LAW.', 'descriptionLinks': None, 'verified': False, 'created': datetime.datetime(2013, 7, 18, 2, 33, 6, tzinfo=datetime.timezone.utc), 'followersCount': 35, 'friendsCount': 56, 'statusesCount': 2750, 'favouritesCount': 1454, 'listedCount': 0, 'mediaCount': 137, 'location': 'India', 'protected': False, 'link': None, 'profileImageUrl': 'https://pbs.twimg.com/profile_images/1519709501058068483/xGZpr6at_normal.jpg', 'profileBannerUrl': None, 'label': None}",2019-05-09 22:50:13+00:00,"#LokSabhaElections2019 #AayegaToModiHi #BJPMission2019 #NamoForNewIndia 
गांधीजी का श्रेष्ठ आंदोलन का तरीका होता था _असहयोग ( non co_operation)। जो हमारी राष्ट्रवादी विचारधारा से सहमत नहीं हैं, उनके साथ हर स्तर पर अघोषित असहयोग/ बहिष्कार (non co_operation/boycott) किया जाए। RT",India,False,35,2013-07-18 02:33:06+00:00
"{'username': 'ScientistVikas', 'id': 2260565305, 'displayname': 'Vikas, the Science guy💙', 'rawDescription': 'Researching', 'renderedDescription': 'Researching', 'descriptionLinks': None, 'verified': False, 'created': datetime.datetime(2013, 12, 24, 18, 4, 23, tzinfo=datetime.timezone.utc), 'followersCount': 285, 'friendsCount': 688, 'statusesCount': 13609, 'favouritesCount': 8391, 'listedCount': 4, 'mediaCount': 607, 'location': 'Andaman And Nicobar, India', 'protected': False, 'link': {'text': 'whatsapp.com', 'url': 'http://whatsapp.com', 'tcourl': 'https://t.co/ZopgRU7deh', 'indices': (0, 23)}, 'profileImageUrl': 'https://pbs.twimg.com/profile_images/1336136652066938882/yIho8FMs_normal.jpg', 'profileBannerUrl': 'https://pbs.twimg.com/profile_banners/2260565305/1607395064', 'label': None}",2019-05-09 22:38:27+00:00,"Sir, hum jaise aapke fans ko lagta hai ki party aapka boycott kar rahi. Even malviya ka it cell bhi aapke tweets ko share nai karta. 
2 kaudi ke farzi leaders bhi 1000 RTs paate hai. Aapke prati ye vyavhar nindaniya hai...
More power to u sir. God bless u.","Andaman And Nicobar, India",False,285,2013-12-24 18:04:23+00:00
"{'username': 'ScientistVikas', 'id': 2260565305, 'displayname': 'Vikas, the Science guy💙', 'rawDescription': 'Researching', 'renderedDescription': 'Researching', 'descriptionLinks': None, 'verified': False, 'created': datetime.datetime(2013, 12, 24, 18, 4, 23, tzinfo=datetime.timezone.utc), 'followersCount': 285, 'friendsCount': 688, 'statusesCount': 13609, 'favouritesCount': 8391, 'listedCount': 4, 'mediaCount': 607, 'location': 'Andaman And Nicobar, India', 'protected': False, 'link': {'text': 'whatsapp.com', 'url': 'http://whatsapp.com', 'tcourl': 'https://t.co/ZopgRU7deh', 'indices': (0, 23)}, 'profileImageUrl': 'https://pbs.twimg.com/profile_images/1336136652066938882/yIho8FMs_normal.jpg', 'profileBannerUrl': 'https://pbs.twimg.com/profile_banners/2260565305/1607395064', 'label': None}",2019-05-09 22:37:30+00:00,"@sharadskn @BJP4India @BJP4UP @BJPLive @BJP4MP @BJP4Maharashtra @BJP4Odisha @BJP4Delhi Sir, hum jaise aapke fans ko lagta hai ki party aapka boycott kar rahi. Even malviya ka it cell bhi aapke tweets ko share nai karta. 
2 kaudi ke farzi leaders bhi 1000 RTs paate hai. Aapke prati ye vyavhar nindaniya hai...
More power to u sir. God bless u.","Andaman And Nicobar, India",False,285,2013-12-24 18:04:23+00:00
"{'username': 'ScientistVikas', 'id': 2260565305, 'displayname': 'Vikas, the Science guy💙', 'rawDescription': 'Researching', 'renderedDescription': 'Researching', 'descriptionLinks': None, 'verified': False, 'created': datetime.datetime(2013, 12, 24, 18, 4, 23, tzinfo=datetime.timezone.utc), 'followersCount': 285, 'friendsCount': 688, 'statusesCount': 13609, 'favouritesCount': 8391, 'listedCount': 4, 'mediaCount': 607, 'location': 'Andaman And Nicobar, India', 'protected': False, 'link': {'text': 'whatsapp.com', 'url': 'http://whatsapp.com', 'tcourl': 'https://t.co/ZopgRU7deh', 'indices': (0, 23)}, 'profileImageUrl': 'https://pbs.twimg.com/profile_images/1336136652066938882/yIho8FMs_normal.jpg', 'profileBannerUrl': 'https://pbs.twimg.com/profile_banners/2260565305/1607395064', 'label': None}",2019-05-09 22:36:28+00:00,"@sharadskn @narendramodi @rajnathsingh @DrRamapati @BJP4UP @BJP4India @BJPLive @kpmaurya1 @AmitShah @myogiadityanath Sir, hum jaise aapke fans ko lagta hai ki party aapka boycott kar rahi. Even malviya ka it cell bhi aapke tweets ko share nai karta. 
2 kaudi ke farzi leaders bhi 1000 RTs paate hai. Aapke prati ye vyavhar nindaniya hai...
More power to u sir. God bless u.","Andaman And Nicobar, India",False,285,2013-12-24 18:04:23+00:00
"{'username': 'HydWatch', 'id': 797761076595068928, 'displayname': 'Hyderabad Civic Problem scanner', 'rawDescription': ""News with Focus on people's problems in Sarcastic🙃 Tone for Better India with Public Transport Development🌲Political ReTweets r for Fun & GK 🌳 🌊🐢"", 'renderedDescription': ""News with Focus on people's problems in Sarcastic🙃 Tone for Better India with Public Transport Development🌲Political ReTweets r for Fun & GK 🌳 🌊🐢"", 'descriptionLinks': None, 'verified': False, 'created': datetime.datetime(2016, 11, 13, 11, 20, 37, tzinfo=datetime.timezone.utc), 'followersCount': 7133, 'friendsCount': 5561, 'statusesCount': 309574, 'favouritesCount': 190835, 'listedCount': 36, 'mediaCount': 6808, 'location': 'Hitech City, Rajendra Nagar', 'protected': False, 'link': None, 'profileImageUrl': 'https://pbs.twimg.com/profile_images/1606993131786113025/jng1COx__normal.jpg', 'profileBannerUrl': 'https://pbs.twimg.com/profile_banners/797761076595068928/1581518980', 'label': None}",2019-05-09 19:37:26+00:00,"#RaviPrakashTv9 Once A #Naxalite ( Supporter) transfored As a Capitalist thru Blackmail Journalistic Venture in #TV9 ? media need to tell True history of these Men , Common ppl need to boycott , block value less TVChannels @IndiaToday @thenewsminute @99tvtelugu @AP24x7live @ndtv https://t.co/OOJYY7NE86","Hitech City, Rajendra Nagar",False,7133,2016-11-13 11:20:37+00:00
