user,date,rawContent,user_location,verified,followers,created
"{'username': 'Bankim1555', 'id': 3224165617, 'displayname': 'Bankim Mazumdar', 'rawDescription': 'An ordinary person, who loves his Country & living beings and respects rational & reasonable differing views.', 'renderedDescription': 'An ordinary person, who loves his Country & living beings and respects rational & reasonable differing views.', 'descriptionLinks': None, 'verified': False, 'created': datetime.datetime(2015, 5, 23, 10, 25, 54, tzinfo=datetime.timezone.utc), 'followersCount': 45, 'friendsCount': 154, 'statusesCount': 20761, 'favouritesCount': 617, 'listedCount': 9, 'mediaCount': 345, 'location': '', 'protected': False, 'link': None, 'profileImageUrl': 'https://pbs.twimg.com/profile_images/1207975152383709187/Pky2-5d7_normal.jpg', 'profileBannerUrl': 'https://pbs.twimg.com/profile_banners/3224165617/1575264832', 'label': None}",2016-06-12 15:27:53+00:00,@AmitShahArmy @sardesairajdeep Why boycott? Shameful act expected frm shameless entities! What's wrong wid dat? Is nt IndiaToday shameless?,,False,45,2015-05-23 10:25:54+00:00
"{'username': 'Bankim1555', 'id': 3224165617, 'displayname': 'Bankim Mazumdar', 'rawDescription': 'An ordinary person, who loves his Country & living beings and respects rational & reasonable differing views.', 'renderedDescription': 'An ordinary person, who loves his Country & living beings and respects rational & reasonable differing views.', 'descriptionLinks': None, 'verified': False, 'created': datetime.datetime(2015, 5, 23, 10, 25, 54, tzinfo=datetime.timezone.utc), 'followersCount': 45, 'friendsCount': 154, 'statusesCount': 20761, 'favouritesCount': 617, 'listedCount': 9, 'mediaCount': 345, 'location': '', 'protected': False, 'link': None, 'profileImageUrl': 'https://pbs.twimg.com/profile_images/1207975152383709187/Pky2-5d7_normal.jpg', 'profileBannerUrl': 'https://pbs.twimg.com/profile_banners/3224165617/1575264832', 'label': None}",2016-06-10 09:30:41+00:00,"@IndianExpress Let us BOYCOTT Chinese goods to teach this hypocrite Country a good lesson! By d way, who is disrespecting Pak sovereignty?",,False,45,2015-05-23 10:25:54+00:00
"{'username': 'Bankim1555', 'id': 3224165617, 'displayname': 'Bankim Mazumdar', 'rawDescription': 'An ordinary person, who loves his Country & living beings and respects rational & reasonable differing views.', 'renderedDescription': 'An ordinary person, who loves his Country & living beings and respects rational & reasonable differing views.', 'descriptionLinks': None, 'verified': False, 'created': datetime.datetime(2015, 5, 23, 10, 25, 54, tzinfo=datetime.timezone.utc), 'followersCount': 45, 'friendsCount': 154, 'statusesCount': 20761, 'favouritesCount': 617, 'listedCount': 9, 'mediaCount': 345, 'location': '', 'protected': False, 'link': None, 'profileImageUrl': 'https://pbs.twimg.com/profile_images/1207975152383709187/Pky2-5d7_normal.jpg', 'profileBannerUrl': 'https://pbs.twimg.com/profile_banners/3224165617/1575264832', 'label': None}",2016-06-10 05:58:10+00:00,"@TimesNow Time to boycott all Chinese goods! Govt can't help, under international obligations. But, we Indians, can boycott of our own!",,False,45,2015-05-23 10:25:54+00:00
"{'username': 'ganapathyhegde', 'id': 162327125, 'displayname': 'ganapathy hegde', 'rawDescription': 'retired  UAE army officer.', 'renderedDescription': 'retired  UAE army officer.', 'descriptionLinks': None, 'verified': False, 'created': datetime.datetime(2010, 7, 3, 9, 40, 49, tzinfo=datetime.timezone.utc), 'followersCount': 663, 'friendsCount': 1752, 'statusesCount': 50492, 'favouritesCount': 77395, 'listedCount': 14, 'mediaCount': 1425, 'location': 'Bengaluru South, India', 'protected': False, 'link': None, 'profileImageUrl': 'https://pbs.twimg.com/profile_images/1544536042903986176/HUCXQawl_normal.jpg', 'profileBannerUrl': 'https://pbs.twimg.com/profile_banners/162327125/1619702258', 'label': None}",2016-06-09 18:10:27+00:00,There should be boycott of all anti national films.,"Bengaluru South, India",False,663,2010-07-03 09:40:49+00:00
"{'username': 'ParwaniKiran', 'id': 735425004670713857, 'displayname': 'Kiran Parwani', 'rawDescription': '', 'renderedDescription': '', 'descriptionLinks': None, 'verified': False, 'created': datetime.datetime(2016, 5, 25, 10, 59, 19, tzinfo=datetime.timezone.utc), 'followersCount': 22, 'friendsCount': 2, 'statusesCount': 1444, 'favouritesCount': 2522, 'listedCount': 1, 'mediaCount': 141, 'location': '', 'protected': False, 'link': None, 'profileImageUrl': 'https://pbs.twimg.com/profile_images/736612781932347392/twvSktuY_normal.jpg', 'profileBannerUrl': None, 'label': None}",2016-06-09 18:04:37+00:00,"भारत एक हिन्दू राष्ट्र है और मीडिया हिंदुत्व की जडें उखाड़ने में लगा है।
Boycott Media
#InjusticeToHinduSaints https://t.co/M4fJfLzPkR",,False,22,2016-05-25 10:59:19+00:00
"{'username': 'LukeKennyLIVE', 'id': 2167344558, 'displayname': 'LukeKennyOfficial', 'rawDescription': 'Rock n Roll Mercenary', 'renderedDescription': 'Rock n Roll Mercenary', 'descriptionLinks': None, 'verified': False, 'created': datetime.datetime(2013, 10, 31, 22, 27, 41, tzinfo=datetime.timezone.utc), 'followersCount': 1172, 'friendsCount': 20, 'statusesCount': 1350, 'favouritesCount': 487, 'listedCount': 12, 'mediaCount': 315, 'location': 'Mumbai, India', 'protected': False, 'link': None, 'profileImageUrl': 'https://pbs.twimg.com/profile_images/598916436547883008/_LkTl_vK_normal.jpg', 'profileBannerUrl': 'https://pbs.twimg.com/profile_banners/2167344558/1641894252', 'label': None}",2016-06-09 06:11:28+00:00,Boycott! Boycott!! Boycott!!! https://t.co/ZoYBRoCktt,"Mumbai, India",False,1172,2013-10-31 22:27:41+00:00
"{'username': 'ganapathyhegde', 'id': 162327125, 'displayname': 'ganapathy hegde', 'rawDescription': 'retired  UAE army officer.', 'renderedDescription': 'retired  UAE army officer.', 'descriptionLinks': None, 'verified': False, 'created': datetime.datetime(2010, 7, 3, 9, 40, 49, tzinfo=datetime.timezone.utc), 'followersCount': 663, 'friendsCount': 1752, 'statusesCount': 50492, 'favouritesCount': 77395, 'listedCount': 14, 'mediaCount': 1425, 'location': 'Bengaluru South, India', 'protected': False, 'link': None, 'profileImageUrl': 'https://pbs.twimg.com/profile_images/1544536042903986176/HUCXQawl_normal.jpg', 'profileBannerUrl': 'https://pbs.twimg.com/profile_banners/162327125/1619702258', 'label': None}",2016-06-08 14:41:42+00:00,"Udtha punjab is insult to punjab and sikhs.
Looks like it is financed by AAP.
Boycott the movie.","Bengaluru South, India",False,663,2010-07-03 09:40:49+00:00
"{'username': 'veejay_vijay', 'id': 597204049, 'displayname': 'Vijay Bhaskar', 'rawDescription': 'राष्ट्रहित सर्वोपरि ।', 'renderedDescription': 'राष्ट्रहित सर्वोपरि ।', 'descriptionLinks': None, 'verified': False, 'created': datetime.datetime(2012, 6, 2, 7, 59, 31, tzinfo=datetime.timezone.utc), 'followersCount': 101, 'friendsCount': 464, 'statusesCount': 3469, 'favouritesCount': 1431, 'listedCount': 3, 'mediaCount': 163, 'location': 'Vishakhapatnam, India', 'protected': False, 'link': None, 'profileImageUrl': 'https://pbs.twimg.com/profile_images/878977076539252736/tG_a2CmE_normal.jpg', 'profileBannerUrl': 'https://pbs.twimg.com/profile_banners/597204049/1482734032', 'label': None}",2016-06-07 18:04:00+00:00,Guys Let's uninstall @amazon lets boycott like we did earlier who played with our religious sentiment.  https://t.co/xB8myYMLs7,"Vishakhapatnam, India",False,101,2012-06-02 07:59:31+00:00
"{'username': 'Kavita_M57', 'id': 3050197880, 'displayname': 'KavitaM 🇮🇳', 'rawDescription': 'Proud Hindu. Staunch supporter of NAMO and proud to be followed by him. \nStrongly allergic to INC AAP LEFT etc.', 'renderedDescription': 'Proud Hindu. Staunch supporter of NAMO and proud to be followed by him. \nStrongly allergic to INC AAP LEFT etc.', 'descriptionLinks': None, 'verified': False, 'created': datetime.datetime(2015, 2, 28, 15, 44, 40, tzinfo=datetime.timezone.utc), 'followersCount': 9850, 'friendsCount': 2316, 'statusesCount': 213042, 'favouritesCount': 144203, 'listedCount': 115, 'mediaCount': 5442, 'location': '', 'protected': False, 'link': None, 'profileImageUrl': 'https://pbs.twimg.com/profile_images/1559512659653165057/o_0ems1q_normal.jpg', 'profileBannerUrl': None, 'label': None}",2016-06-07 17:24:03+00:00,How come AAP spokespersons come on news hour only when the subject is anti Bjp. Otherwise they boycott timesnow  #UdtaPolitics,,False,9850,2015-02-28 15:44:40+00:00
"{'username': 'Saliltoday', 'id': 118997626, 'displayname': 'Salil Mathur🇮🇳', 'rawDescription': '100% pro PM Modi. Secular but not by your definition. Dad & grandfather. Profoundly honoured to be followed by our  Honourable PM Narendra Modiji. RT no endorse', 'renderedDescription': '100% pro PM Modi. Secular but not by your definition. Dad & grandfather. Profoundly honoured to be followed by our  Honourable PM Narendra Modiji. RT no endorse', 'descriptionLinks': None, 'verified': False, 'created': datetime.datetime(2010, 3, 2, 10, 30, 45, tzinfo=datetime.timezone.utc), 'followersCount': 13880, 'friendsCount': 2135, 'statusesCount': 212052, 'favouritesCount': 160452, 'listedCount': 103, 'mediaCount': 964, 'location': 'India. ', 'protected': False, 'link': None, 'profileImageUrl': 'https://pbs.twimg.com/profile_images/1593430176926343169/hmJ2zLpG_normal.jpg', 'profileBannerUrl': 'https://pbs.twimg.com/profile_banners/118997626/1599795097', 'label': None}",2016-06-07 14:21:50+00:00,BJP must boycott a channel that has been criticism the in an extreme and overblown reaction for long #NDTVKiBattiGul,India. ,False,13880,2010-03-02 10:30:45+00:00
"{'username': 'gvbadiger', 'id': 637088448, 'displayname': 'Girish Vittal Badiger | ಗಿರೀಶ ವಿಠ್ಠಲ ಬಡಿಗೇರ 🇮🇳', 'rawDescription': 'Manas Ekam, Vachas Ekam, Karmany Ekam Mahatmanam. 😇', 'renderedDescription': 'Manas Ekam, Vachas Ekam, Karmany Ekam Mahatmanam. 😇', 'descriptionLinks': None, 'verified': False, 'created': datetime.datetime(2012, 7, 16, 14, 21, 59, tzinfo=datetime.timezone.utc), 'followersCount': 1115, 'friendsCount': 314, 'statusesCount': 4974, 'favouritesCount': 10240, 'listedCount': 1, 'mediaCount': 1011, 'location': 'Belgaum, India', 'protected': False, 'link': {'text': 'gvbadiger.com', 'url': 'http://gvbadiger.com', 'tcourl': 'https://t.co/HhQV1a0275', 'indices': (0, 23)}, 'profileImageUrl': 'https://pbs.twimg.com/profile_images/1475070104006062082/QBZys1S6_normal.jpg', 'profileBannerUrl': 'https://pbs.twimg.com/profile_banners/637088448/1527440682', 'label': None}",2016-06-07 12:59:52+00:00,"Boycott @amazon 
How Dare you to Print #Hindu Goddess Pics On Inner Wares &amp; Mats?
You are Going To Face This In Ur Future Days
#Shameless","Belgaum, India",False,1115,2012-07-16 14:21:59+00:00
"{'username': 'gaganabh', 'id': 84006263, 'displayname': 'GP', 'rawDescription': 'Ardent fan of @shahidkapoor', 'renderedDescription': 'Ardent fan of @shahidkapoor', 'descriptionLinks': None, 'verified': False, 'created': datetime.datetime(2009, 10, 21, 5, 14, 35, tzinfo=datetime.timezone.utc), 'followersCount': 5863, 'friendsCount': 77, 'statusesCount': 105752, 'favouritesCount': 345, 'listedCount': 47, 'mediaCount': 2672, 'location': 'Mumbai, India', 'protected': False, 'link': None, 'profileImageUrl': 'https://pbs.twimg.com/profile_images/1556570360811700224/M2rDZ_kB_normal.jpg', 'profileBannerUrl': 'https://pbs.twimg.com/profile_banners/84006263/1591359223', 'label': None}",2016-06-06 20:12:06+00:00,"Kaminey ke time swine flue.
Haider ke time Boycott.
Now #UdtaPunjabCensored
@shahidkapoor bhai jab apna best dete toh koi anhoni hojati hai.","Mumbai, India",False,5863,2009-10-21 05:14:35+00:00
"{'username': 'rajasank', 'id': 1063910995, 'displayname': 'Industracker', 'rawDescription': ""Descendant of one of most ancient civilizations in the world.\n\nAllow me 2 live in dignity,I'll double the courtesy 4 u.\n\nRTs are to spread other points of view"", 'renderedDescription': ""Descendant of one of most ancient civilizations in the world.\n\nAllow me 2 live in dignity,I'll double the courtesy 4 u.\n\nRTs are to spread other points of view"", 'descriptionLinks': None, 'verified': False, 'created': datetime.datetime(2013, 1, 5, 20, 16, 18, tzinfo=datetime.timezone.utc), 'followersCount': 198, 'friendsCount': 93, 'statusesCount': 12074, 'favouritesCount': 2273, 'listedCount': 6, 'mediaCount': 265, 'location': '', 'protected': False, 'link': None, 'profileImageUrl': 'https://pbs.twimg.com/profile_images/765502337511108608/ypLZ-8ER_normal.jpg', 'profileBannerUrl': 'https://pbs.twimg.com/profile_banners/1063910995/1470622608', 'label': None}",2016-06-06 17:24:40+00:00,"@rvaidya2000 @RahulEaswar Dear Hindus &amp; Devotees,boycott any referendum farce, but back the decision of the Devaswom Board 100%.",,False,198,2013-01-05 20:16:18+00:00
"{'username': 'yparikh', 'id': 140841482, 'displayname': 'Yogesh Parikh 🇮🇳', 'rawDescription': 'Vision: India as Super Power; \n                        ❤️ Namma Chennai;', 'renderedDescription': 'Vision: India as Super Power; \n                        ❤️ Namma Chennai;', 'descriptionLinks': None, 'verified': False, 'created': datetime.datetime(2010, 5, 6, 14, 6, 14, tzinfo=datetime.timezone.utc), 'followersCount': 615, 'friendsCount': 1122, 'statusesCount': 66398, 'favouritesCount': 51915, 'listedCount': 28, 'mediaCount': 550, 'location': 'Chennai', 'protected': False, 'link': None, 'profileImageUrl': 'https://pbs.twimg.com/profile_images/1567192468239810560/RPZDnIDi_normal.jpg', 'profileBannerUrl': 'https://pbs.twimg.com/profile_banners/140841482/1420176708', 'label': None}",2016-06-06 16:35:40+00:00,If @TimesNow really respects it's own reporters then they should boycott Cong till this MLA apologizes else it's a farce. #DemocracyForSale,Chennai,False,615,2010-05-06 14:06:14+00:00
"{'username': '1Raghavan', 'id': 1372628112, 'displayname': 'Raghavan', 'rawDescription': 'A senior citizen. Working as HR professional in private sector companies. Lives in Bangalore', 'renderedDescription': 'A senior citizen. Working as HR professional in private sector companies. Lives in Bangalore', 'descriptionLinks': None, 'verified': False, 'created': datetime.datetime(2013, 4, 22, 17, 25, 9, tzinfo=datetime.timezone.utc), 'followersCount': 637, 'friendsCount': 1347, 'statusesCount': 7850, 'favouritesCount': 2042, 'listedCount': 10, 'mediaCount': 337, 'location': 'Bengaluru', 'protected': False, 'link': None, 'profileImageUrl': 'https://pbs.twimg.com/profile_images/1568565784435367936/r5p3TOiQ_normal.jpg', 'profileBannerUrl': None, 'label': None}",2016-06-06 16:27:28+00:00,kill them economically; don't BUY; Boycott https://t.co/LUm4j9JIW3,Bengaluru,False,637,2013-04-22 17:25:09+00:00
