user,date,rawContent,user_location,verified,followers,created
"{'username': '24kd', 'id': 42577985, 'displayname': 'Krishna', 'rawDescription': 'Creative soul with high political awareness and views', 'renderedDescription': 'Creative soul with high political awareness and views', 'descriptionLinks': None, 'verified': False, 'created': datetime.datetime(2009, 5, 26, 6, 28, 16, tzinfo=datetime.timezone.utc), 'followersCount': 131, 'friendsCount': 393, 'statusesCount': 1151, 'favouritesCount': 50433, 'listedCount': 1, 'mediaCount': 5, 'location': 'Mumbai,india', 'protected': False, 'link': None, 'profileImageUrl': 'https://pbs.twimg.com/profile_images/1388489659630559234/FHbPB34D_normal.jpg', 'profileBannerUrl': 'https://pbs.twimg.com/profile_banners/42577985/1402541716', 'label': None}",2015-06-14 16:39:05+00:00,@sambitswaraj @TimesNow why don't u boycott this channel it makes a mockery of the govt,"Mumbai,india",False,131,2009-05-26 06:28:16+00:00
"{'username': 'Aish17aer', 'id': 442130522, 'displayname': 'Dr Aishwarya S 🇮🇳', 'rawDescription': 'PhD, Biotech,  Leading Udvat Enviro.\n\n🙏🏿My PM follows me🙏🏿', 'renderedDescription': 'PhD, Biotech,  Leading Udvat Enviro.\n\n🙏🏿My PM follows me🙏🏿', 'descriptionLinks': None, 'verified': False, 'created': datetime.datetime(2011, 12, 20, 19, 48, 32, tzinfo=datetime.timezone.utc), 'followersCount': 12077, 'friendsCount': 1587, 'statusesCount': 42407, 'favouritesCount': 33575, 'listedCount': 55, 'mediaCount': 3386, 'location': '', 'protected': False, 'link': None, 'profileImageUrl': 'https://pbs.twimg.com/profile_images/1560108893661200384/lG35Qyjq_normal.jpg', 'profileBannerUrl': 'https://pbs.twimg.com/profile_banners/442130522/1402946525', 'label': None}",2015-06-14 12:13:28+00:00,"@kailashwg @kailashkaushik8 @SushmaSwaraj @BJP shldnt bother to answer to Times, since its a Disgrace to Journalism! Boycott Times",,False,12077,2011-12-20 19:48:32+00:00
"{'username': 'jhaprabhat20', 'id': 938455268, 'displayname': 'Prabhat Jha', 'rawDescription': 'Retired as D.G.M.from Barauni Thermal(B.S.E.B.,Patna) .', 'renderedDescription': 'Retired as D.G.M.from Barauni Thermal(B.S.E.B.,Patna) .', 'descriptionLinks': None, 'verified': False, 'created': datetime.datetime(2012, 11, 10, 5, 45, 30, tzinfo=datetime.timezone.utc), 'followersCount': 615, 'friendsCount': 769, 'statusesCount': 7808, 'favouritesCount': 17904, 'listedCount': 5, 'mediaCount': 873, 'location': 'Patna, Bihar', 'protected': False, 'link': None, 'profileImageUrl': 'https://pbs.twimg.com/profile_images/743597355052609536/6hfFkked_normal.jpg', 'profileBannerUrl': 'https://pbs.twimg.com/profile_banners/938455268/1466122304', 'label': None}",2015-06-14 11:48:54+00:00,"@Times Now People will boycott your channel,only disgruntled oppos.&amp; crupt like Cong Lalu etc. will watch?","Patna, Bihar",False,615,2012-11-10 05:45:30+00:00
"{'username': 'muralewrites', 'id': 11433002, 'displayname': 'murali mattancherry', 'rawDescription': 'Public Relations practitioner - Freelance content marketer, Writer, Executive Search professional, Freelancer, Cyclist 🚵🚵🚵 - Chennai & Kochi', 'renderedDescription': 'Public Relations practitioner - Freelance content marketer, Writer, Executive Search professional, Freelancer, Cyclist 🚵🚵🚵 - Chennai & Kochi', 'descriptionLinks': None, 'verified': False, 'created': datetime.datetime(2007, 12, 22, 14, 50, 52, tzinfo=datetime.timezone.utc), 'followersCount': 4483, 'friendsCount': 3176, 'statusesCount': 108581, 'favouritesCount': 31785, 'listedCount': 110, 'mediaCount': 3010, 'location': 'Chennai, India', 'protected': False, 'link': None, 'profileImageUrl': 'https://pbs.twimg.com/profile_images/1603722358891479040/yTTrPAlB_normal.jpg', 'profileBannerUrl': 'https://pbs.twimg.com/profile_banners/11433002/1671177990', 'label': None}",2015-06-14 11:34:48+00:00,If bjp has any pride and empathy with its supporters they must boycott shameless Pulp channel timesnow. Period. #westandwithsushmaswaraj,"Chennai, India",False,4483,2007-12-22 14:50:52+00:00
"{'username': 'chweet_agan', 'id': 301258872, 'displayname': 'agan s', 'rawDescription': 'very simple.......lovable person', 'renderedDescription': 'very simple.......lovable person', 'descriptionLinks': None, 'verified': False, 'created': datetime.datetime(2011, 5, 19, 4, 55, 40, tzinfo=datetime.timezone.utc), 'followersCount': 195, 'friendsCount': 447, 'statusesCount': 2366, 'favouritesCount': 43935, 'listedCount': 3, 'mediaCount': 342, 'location': 'india', 'protected': False, 'link': None, 'profileImageUrl': 'https://pbs.twimg.com/profile_images/1339595955566387201/fgGj_rd5_normal.jpg', 'profileBannerUrl': 'https://pbs.twimg.com/profile_banners/301258872/1423298251', 'label': None}",2015-06-13 18:34:30+00:00,"@actor_jayamravi if u didn't give clear explanation , al Vijay fans vil boycott ur movie
#NotFairJayamRavi",india,False,195,2011-05-19 04:55:40+00:00
"{'username': '7955b74bea704bc', 'id': 2733939398, 'displayname': 'Ganesh Kumar', 'rawDescription': '', 'renderedDescription': '', 'descriptionLinks': None, 'verified': False, 'created': datetime.datetime(2014, 8, 15, 7, 42, 32, tzinfo=datetime.timezone.utc), 'followersCount': 7, 'friendsCount': 42, 'statusesCount': 1473, 'favouritesCount': 1544, 'listedCount': 1, 'mediaCount': 0, 'location': '', 'protected': False, 'link': None, 'profileImageUrl': 'https://pbs.twimg.com/profile_images/1214583976670715905/_L-zVN6P_normal.jpg', 'profileBannerUrl': None, 'label': None}",2015-06-11 17:16:08+00:00,I think congress must boycott Arnob's fish Market News Hour pro BJP debate.,,False,7,2014-08-15 07:42:32+00:00
"{'username': 'bimal_pr', 'id': 1889179298, 'displayname': 'Bimal Prasad Mohapatra', 'rawDescription': 'Sr. Research Fellow in DRaS, Faculty of Management Studies, Resource Person in Geopolitics, Media Critics, Novelist & Columnist', 'renderedDescription': 'Sr. Research Fellow in DRaS, Faculty of Management Studies, Resource Person in Geopolitics, Media Critics, Novelist & Columnist', 'descriptionLinks': None, 'verified': False, 'created': datetime.datetime(2013, 9, 21, 6, 47, 21, tzinfo=datetime.timezone.utc), 'followersCount': 4159, 'friendsCount': 4554, 'statusesCount': 216948, 'favouritesCount': 62459, 'listedCount': 201, 'mediaCount': 1941, 'location': '9337673955', 'protected': False, 'link': {'text': 'dras.in', 'url': 'http://dras.in', 'tcourl': 'https://t.co/3Jgej9DOhI', 'indices': (0, 23)}, 'profileImageUrl': 'https://pbs.twimg.com/profile_images/445800649062506496/q3UQf4B7_normal.jpeg', 'profileBannerUrl': 'https://pbs.twimg.com/profile_banners/1889179298/1597336240', 'label': None}",2015-06-11 01:52:30+00:00,"Let us boycott these anti-national elements @sagarikaghose @waglenikhil for the sake on mother land. @Gen_VKSingh, you are right.",9337673955,False,4159,2013-09-21 06:47:21+00:00
"{'username': 'Anirban1202', 'id': 207864984, 'displayname': 'Anirban Dasgupta', 'rawDescription': 'Dil mein hai vishwas, hum honge kamyaab eik din. Towards a corruption free India.', 'renderedDescription': 'Dil mein hai vishwas, hum honge kamyaab eik din. Towards a corruption free India.', 'descriptionLinks': None, 'verified': False, 'created': datetime.datetime(2010, 10, 26, 5, 30, 58, tzinfo=datetime.timezone.utc), 'followersCount': 362, 'friendsCount': 138, 'statusesCount': 15346, 'favouritesCount': 5392, 'listedCount': 13, 'mediaCount': 295, 'location': 'Bangalore', 'protected': False, 'link': None, 'profileImageUrl': 'https://pbs.twimg.com/profile_images/833121203590201346/06jgR_-G_normal.jpg', 'profileBannerUrl': 'https://pbs.twimg.com/profile_banners/207864984/1428129412', 'label': None}",2015-06-08 12:23:40+00:00,@muntaziraapka @ashutosh83B @sambitswaraj @AAPforINDIA @LambaAlka @jvsk3 @msrbpl He's hardly allowed to speak. Shud boycott pro-BJP channels,Bangalore,False,362,2010-10-26 05:30:58+00:00
"{'username': 'NewsX', 'id': 23405846, 'displayname': 'NewsX', 'rawDescription': ""India's leading English News Channel and the #1 choice of the young, aspiring and urbane. LiveTV: https://t.co/CuxXTdLnWe…"", 'renderedDescription': ""India's leading English News Channel and the #1 choice of the young, aspiring and urbane. LiveTV: youtube.com/watch?v=ifTCem…"", 'descriptionLinks': [{'text': 'youtube.com/watch?v=ifTCem', 'url': 'http://youtube.com/watch?v=ifTCem', 'tcourl': 'https://t.co/CuxXTdLnWe', 'indices': (98, 121)}], 'verified': True, 'created': datetime.datetime(2009, 3, 9, 5, 24, 34, tzinfo=datetime.timezone.utc), 'followersCount': 563238, 'friendsCount': 235, 'statusesCount': 387795, 'favouritesCount': 316, 'listedCount': 849, 'mediaCount': 122166, 'location': 'India', 'protected': False, 'link': {'text': 'newsx.com', 'url': 'https://www.newsx.com/', 'tcourl': 'https://t.co/O3ctG6Wm2W', 'indices': (0, 23)}, 'profileImageUrl': 'https://pbs.twimg.com/profile_images/1605529464640716802/e5uVQ9wV_normal.jpg', 'profileBannerUrl': 'https://pbs.twimg.com/profile_banners/23405846/1671888476', 'label': None}",2015-06-08 05:39:54+00:00,Congress will boycott R.K. Nagar Assembly constituency by-poll.,India,True,563238,2009-03-09 05:24:34+00:00
