user,date,rawContent,user_location,verified,followers,created
"{'username': 'Arunangsu', 'id': 59402102, 'displayname': 'Arunangsu RC', 'rawDescription': 'Ex Chief Photo Journalist, The Hindu Group.', 'renderedDescription': 'Ex Chief Photo Journalist, The Hindu Group.', 'descriptionLinks': None, 'verified': False, 'created': datetime.datetime(2009, 7, 23, 8, 37, 8, tzinfo=datetime.timezone.utc), 'followersCount': 844, 'friendsCount': 1543, 'statusesCount': 20468, 'favouritesCount': 475, 'listedCount': 35, 'mediaCount': 839, 'location': 'Mumbai, India', 'protected': False, 'link': {'text': 'thehindu.com', 'url': 'http://www.thehindu.com', 'tcourl': 'https://t.co/OUaSDh8ogM', 'indices': (0, 23)}, 'profileImageUrl': 'https://pbs.twimg.com/profile_images/1058756876765093888/t9m06pFs_normal.jpg', 'profileBannerUrl': 'https://pbs.twimg.com/profile_banners/59402102/1541262453', 'label': None}",2017-07-09 11:36:45+00:00,Qatar to seek compensation for damages caused by Arab boycott https://t.co/UBYJeLGwSN,"Mumbai, India",False,844,2009-07-23 08:37:08+00:00
"{'username': 'nandtara', 'id': 74810575, 'displayname': 'Be the Change👊🏻', 'rawDescription': 'Just another traveller who loves good cinema, John Fowles & Dylan. Abhor social/religious discrimination. No party can control my views/tweets. SECULAR forever', 'renderedDescription': 'Just another traveller who loves good cinema, John Fowles & Dylan. Abhor social/religious discrimination. No party can control my views/tweets. SECULAR forever', 'descriptionLinks': None, 'verified': False, 'created': datetime.datetime(2009, 9, 16, 19, 12, 19, tzinfo=datetime.timezone.utc), 'followersCount': 14583, 'friendsCount': 1840, 'statusesCount': 410259, 'favouritesCount': 280721, 'listedCount': 51, 'mediaCount': 8880, 'location': '', 'protected': False, 'link': None, 'profileImageUrl': 'https://pbs.twimg.com/profile_images/1607026776009760768/nknVAgmK_normal.jpg', 'profileBannerUrl': 'https://pbs.twimg.com/profile_banners/74810575/1593114863', 'label': None}",2017-07-09 10:13:01+00:00,Boycott everything dishonest @NupurSharmaBJP suggests. Gujarat was allowed to burn in 2002 and she fraudulently posts that as circa 2017 https://t.co/jI7zHgtbGP,,False,14583,2009-09-16 19:12:19+00:00
"{'username': 'vishwaskapoorvk', 'id': 206325056, 'displayname': 'Vishwas Kapoor', 'rawDescription': 'Actor, Voice artiste, mostly whelmed, overwhelmed and underwhelmed', 'renderedDescription': 'Actor, Voice artiste, mostly whelmed, overwhelmed and underwhelmed', 'descriptionLinks': None, 'verified': False, 'created': datetime.datetime(2010, 10, 22, 18, 46, 41, tzinfo=datetime.timezone.utc), 'followersCount': 310, 'friendsCount': 233, 'statusesCount': 2131, 'favouritesCount': 6797, 'listedCount': 4, 'mediaCount': 348, 'location': 'Mumbai', 'protected': False, 'link': {'text': 'facebook.com/Voice.Act', 'url': 'https://www.facebook.com/Voice.Act', 'tcourl': 'https://t.co/TsPDPoIGxG', 'indices': (0, 23)}, 'profileImageUrl': 'https://pbs.twimg.com/profile_images/1343610662883246080/fnUf25P2_normal.jpg', 'profileBannerUrl': 'https://pbs.twimg.com/profile_banners/206325056/1375297078', 'label': None}",2017-07-09 07:08:41+00:00,"這個帖子是中文。請抵制！

This post is Chinese. Please boycott this !! #BoycottChineseProducts",Mumbai,False,310,2010-10-22 18:46:41+00:00
"{'username': 'Ashish1987sing', 'id': 869606116358881280, 'displayname': 'Indian singh...', 'rawDescription': 'nothing to show', 'renderedDescription': 'nothing to show', 'descriptionLinks': None, 'verified': False, 'created': datetime.datetime(2017, 5, 30, 17, 27, 9, tzinfo=datetime.timezone.utc), 'followersCount': 27, 'friendsCount': 468, 'statusesCount': 1377, 'favouritesCount': 632, 'listedCount': 0, 'mediaCount': 132, 'location': 'India', 'protected': False, 'link': None, 'profileImageUrl': 'https://pbs.twimg.com/profile_images/1264948387868278785/hmu7UgB4_normal.jpg', 'profileBannerUrl': 'https://pbs.twimg.com/profile_banners/869606116358881280/1497643690', 'label': None}",2017-07-09 06:26:37+00:00,Boycott of china https://t.co/p8EdMkliVO,India,False,27,2017-05-30 17:27:09+00:00
"{'username': 'anupravintl', 'id': 94047252, 'displayname': 'PRAVEEN TYAGI', 'rawDescription': '', 'renderedDescription': '', 'descriptionLinks': None, 'verified': False, 'created': datetime.datetime(2009, 12, 2, 8, 13, 7, tzinfo=datetime.timezone.utc), 'followersCount': 89, 'friendsCount': 414, 'statusesCount': 1165, 'favouritesCount': 1068, 'listedCount': 0, 'mediaCount': 23, 'location': 'New Delhi, India', 'protected': False, 'link': {'text': 'anuprav.com', 'url': 'http://www.anuprav.com', 'tcourl': 'https://t.co/hdGxbthuDb', 'indices': (0, 23)}, 'profileImageUrl': 'https://pbs.twimg.com/profile_images/1566267003676925953/XtyJ_NIb_normal.jpg', 'profileBannerUrl': 'https://pbs.twimg.com/profile_banners/94047252/1662262128', 'label': None}",2017-07-09 05:44:50+00:00,Boycott jet airways,"New Delhi, India",False,89,2009-12-02 08:13:07+00:00
"{'username': 'PKotekar', 'id': 291186311, 'displayname': 'l Am Modi.🇮🇳', 'rawDescription': 'Proud to be with BJP since its inception. No compromise on Hindutva. Tremendous faith on our PM Shri. Modi ji. BHARAT MATA KI JAI.', 'renderedDescription': 'Proud to be with BJP since its inception. No compromise on Hindutva. Tremendous faith on our PM Shri. Modi ji. BHARAT MATA KI JAI.', 'descriptionLinks': None, 'verified': False, 'created': datetime.datetime(2011, 5, 1, 16, 3, 2, tzinfo=datetime.timezone.utc), 'followersCount': 5271, 'friendsCount': 3969, 'statusesCount': 336714, 'favouritesCount': 143992, 'listedCount': 119, 'mediaCount': 12809, 'location': 'Thane, India', 'protected': False, 'link': None, 'profileImageUrl': 'https://pbs.twimg.com/profile_images/1562284233162309632/UkN5G0mt_normal.jpg', 'profileBannerUrl': 'https://pbs.twimg.com/profile_banners/291186311/1474174088', 'label': None}",2017-07-09 05:12:55+00:00,"#दगाबाजChina. Bullying. Cheating. Lying. Clinching land. Everything you think can be done openly. You are mistaken.
We will boycott you.","Thane, India",False,5271,2011-05-01 16:03:02+00:00
"{'username': 'Ahindamanjunat1', 'id': 1605542785, 'displayname': 'ಅಹಿಂದ ಮಂಜುನಾಥ್ ಕರ್ನಾಟಕ ಅಹಿಂದ ರಕ್ಷಣಾ ವೇದಿಕೆ', 'rawDescription': 'ಕನ್ನಡಿಗ,ರಿಟ್ವೀಟ್\u200cಗಳು ಅನುಮೋದನೆಗಳ ಅಗತ್ಯವಿಲ್ಲ. Retweets not necessarily endorsements .@ahindamanjunath state Prasident, chef Editor,Jernalist,water Warrier India', 'renderedDescription': 'ಕನ್ನಡಿಗ,ರಿಟ್ವೀಟ್\u200cಗಳು ಅನುಮೋದನೆಗಳ ಅಗತ್ಯವಿಲ್ಲ. Retweets not necessarily endorsements .@ahindamanjunath state Prasident, chef Editor,Jernalist,water Warrier India', 'descriptionLinks': None, 'verified': False, 'created': datetime.datetime(2013, 7, 19, 9, 27, 41, tzinfo=datetime.timezone.utc), 'followersCount': 101, 'friendsCount': 1789, 'statusesCount': 825, 'favouritesCount': 59, 'listedCount': 0, 'mediaCount': 495, 'location': 'Karnataka', 'protected': False, 'link': {'text': 'karv.com', 'url': 'http://www.karv.com', 'tcourl': 'https://t.co/AXWYQqXTPq', 'indices': (0, 23)}, 'profileImageUrl': 'https://pbs.twimg.com/profile_images/1211323566378999808/x2xnUHet_normal.jpg', 'profileBannerUrl': 'https://pbs.twimg.com/profile_banners/1605542785/1629002293', 'label': None}",2017-07-09 04:46:31+00:00,Indians please Boycott china items https://t.co/r34CuC2UAZ,Karnataka,False,101,2013-07-19 09:27:41+00:00
"{'username': 'pravinpspeaks', 'id': 171003701, 'displayname': 'Pravin Pawar 🚩🌷🇮🇳', 'rawDescription': 'E&TC Engg. \n\nशेतकरीराजा\n\nजय जवान 🪖 जय किसान 🌾\n\nजय_मल्हार', 'renderedDescription': 'E&TC Engg. \n\nशेतकरीराजा\n\nजय जवान 🪖 जय किसान 🌾\n\nजय_मल्हार', 'descriptionLinks': None, 'verified': False, 'created': datetime.datetime(2010, 7, 26, 9, 33, tzinfo=datetime.timezone.utc), 'followersCount': 809, 'friendsCount': 1637, 'statusesCount': 28115, 'favouritesCount': 116487, 'listedCount': 4, 'mediaCount': 272, 'location': 'अहिल्यादेवीनगर,महाराष्ट्र.', 'protected': False, 'link': None, 'profileImageUrl': 'https://pbs.twimg.com/profile_images/1575170124784750592/hwzrIYk7_normal.jpg', 'profileBannerUrl': 'https://pbs.twimg.com/profile_banners/171003701/1640544444', 'label': None}",2017-07-09 04:32:48+00:00,If India want to put pressure on China 1st thing to do destroy base economy that is Boycott Chinese products or less using made in china,"अहिल्यादेवीनगर,महाराष्ट्र.",False,809,2010-07-26 09:33:00+00:00
"{'username': 'Muhaimin_khaan', 'id': 314485548, 'displayname': 'khan Abdul Muhaimin', 'rawDescription': 'Civil Engineer.                                                             \nContractor                           \nCity President-AiMiM Students Wing Aurangabad', 'renderedDescription': 'Civil Engineer.                                                             \nContractor                           \nCity President-AiMiM Students Wing Aurangabad', 'descriptionLinks': None, 'verified': False, 'created': datetime.datetime(2011, 6, 10, 10, 17, 15, tzinfo=datetime.timezone.utc), 'followersCount': 276, 'friendsCount': 108, 'statusesCount': 545, 'favouritesCount': 864, 'listedCount': 0, 'mediaCount': 141, 'location': 'India', 'protected': False, 'link': {'text': 'google.co.in', 'url': 'http://www.google.co.in', 'tcourl': 'https://t.co/gMxy9E1HaP', 'indices': (0, 23)}, 'profileImageUrl': 'https://pbs.twimg.com/profile_images/1108728428205887488/CFm28qc5_normal.jpg', 'profileBannerUrl': 'https://pbs.twimg.com/profile_banners/314485548/1637514671', 'label': None}",2017-07-09 03:11:24+00:00,"@TheQuint @arnabrepublic ne #rss ki khaki chaddi ke sath china ke flag ki bra bhi pehen li
Boycott china by @asadowaisi's mim In Aurangabad https://t.co/d6trnBywnd",India,False,276,2011-06-10 10:17:15+00:00
"{'username': 'sampath_s', 'id': 16694043, 'displayname': 'sripath PhD', 'rawDescription': '', 'renderedDescription': '', 'descriptionLinks': None, 'verified': False, 'created': datetime.datetime(2008, 10, 11, 7, 22, 10, tzinfo=datetime.timezone.utc), 'followersCount': 231, 'friendsCount': 336, 'statusesCount': 56588, 'favouritesCount': 23194, 'listedCount': 31, 'mediaCount': 66, 'location': '', 'protected': False, 'link': None, 'profileImageUrl': 'https://pbs.twimg.com/profile_images/1553977546324180992/jnHwETgt_normal.jpg', 'profileBannerUrl': 'https://pbs.twimg.com/profile_banners/16694043/1555513664', 'label': None}",2017-07-09 01:18:24+00:00,@rupasubramanya Does it say 'made in india' or 'made in  china'. Many products carry labels 'imported and marketed in india'. Brand china deserves boycott.,,False,231,2008-10-11 07:22:10+00:00
"{'username': 'Chiruta12345', 'id': 130724379, 'displayname': 'Ashish', 'rawDescription': 'A big movie buff. Working for an organization which gives me a brand value and made me a better person. ! All Tweets mentioned here are personal', 'renderedDescription': 'A big movie buff. Working for an organization which gives me a brand value and made me a better person. ! All Tweets mentioned here are personal', 'descriptionLinks': None, 'verified': False, 'created': datetime.datetime(2010, 4, 8, 3, 34, 14, tzinfo=datetime.timezone.utc), 'followersCount': 824, 'friendsCount': 752, 'statusesCount': 27699, 'favouritesCount': 1385, 'listedCount': 13, 'mediaCount': 1207, 'location': 'Mumbai, Maharashtra', 'protected': False, 'link': None, 'profileImageUrl': 'https://pbs.twimg.com/profile_images/1397719710561542145/P_yPQYYZ_normal.jpg', 'profileBannerUrl': 'https://pbs.twimg.com/profile_banners/130724379/1621487626', 'label': None}",2017-07-08 19:04:32+00:00,Let's boycott #AnandoBrahma #shame on you #Taapsee,"Mumbai, Maharashtra",False,824,2010-04-08 03:34:14+00:00
"{'username': 'pothukuchis', 'id': 134603053, 'displayname': 'పోతుకూచి శ్రీధర్', 'rawDescription': 'Rightist by birth. \nHindu - Indian - ఆంధ్రుడు - ద్విజుడు, in that order. \nSenior Corporate Executive.  \nతెలుగు మఱియు బెౙవాడ వీరాభిమాని.\nAll views personal.', 'renderedDescription': 'Rightist by birth. \nHindu - Indian - ఆంధ్రుడు - ద్విజుడు, in that order. \nSenior Corporate Executive.  \nతెలుగు మఱియు బెౙవాడ వీరాభిమాని.\nAll views personal.', 'descriptionLinks': None, 'verified': False, 'created': datetime.datetime(2010, 4, 18, 22, 57, 47, tzinfo=datetime.timezone.utc), 'followersCount': 715, 'friendsCount': 339, 'statusesCount': 18865, 'favouritesCount': 9915, 'listedCount': 16, 'mediaCount': 5859, 'location': 'Hyderabad, Chennai, Vijayawada', 'protected': False, 'link': None, 'profileImageUrl': 'https://pbs.twimg.com/profile_images/1095639424392744965/XslL3mU0_normal.png', 'profileBannerUrl': 'https://pbs.twimg.com/profile_banners/134603053/1409162484', 'label': None}",2017-07-08 16:38:50+00:00,"@rupasubramanya Boycott can at best be a personal choice. And will not get us anywhere,there's hardly a thing in our daily lives with no Chinese content.","Hyderabad, Chennai, Vijayawada",False,715,2010-04-18 22:57:47+00:00
"{'username': 'paneendrabellur', 'id': 143135729, 'displayname': 'paneendra bellur', 'rawDescription': 'Electrical consulting, volunteer Abhyudaya, One India strong India kashmir,', 'renderedDescription': 'Electrical consulting, volunteer Abhyudaya, One India strong India kashmir,', 'descriptionLinks': None, 'verified': False, 'created': datetime.datetime(2010, 5, 12, 17, 50, 48, tzinfo=datetime.timezone.utc), 'followersCount': 1886, 'friendsCount': 5003, 'statusesCount': 111670, 'favouritesCount': 7544, 'listedCount': 93, 'mediaCount': 47300, 'location': 'Bengaluru, Mysore India', 'protected': False, 'link': None, 'profileImageUrl': 'https://pbs.twimg.com/profile_images/1580468197614288897/twsyVwgN_normal.jpg', 'profileBannerUrl': 'https://pbs.twimg.com/profile_banners/143135729/1443437236', 'label': None}",2017-07-08 13:50:50+00:00,@aroonpurie first government should make it compulsory to clearly display mad in china on products so that we can boycott if possible,"Bengaluru, Mysore India",False,1886,2010-05-12 17:50:48+00:00
"{'username': 'TrivediJagadish', 'id': 876755588298027012, 'displayname': 'Jagadish Trivedi', 'rawDescription': ""I like to interact intelligent people I'm  basically a teacher.Teaching is my passion.I think teaching is a constant process of learning."", 'renderedDescription': ""I like to interact intelligent people I'm  basically a teacher.Teaching is my passion.I think teaching is a constant process of learning."", 'descriptionLinks': None, 'verified': False, 'created': datetime.datetime(2017, 6, 19, 10, 56, 36, tzinfo=datetime.timezone.utc), 'followersCount': 16, 'friendsCount': 99, 'statusesCount': 153, 'favouritesCount': 42, 'listedCount': 0, 'mediaCount': 15, 'location': 'Rajkot, India', 'protected': False, 'link': None, 'profileImageUrl': 'https://pbs.twimg.com/profile_images/1221053696198336512/ZNLD1_ee_normal.jpg', 'profileBannerUrl': None, 'label': None}",2017-07-08 10:44:41+00:00,"Instead of protesting GST,we should boycott Chinese goods.By which we can teach a lesson to both China and Pak which are killing our jawans.","Rajkot, India",False,16,2017-06-19 10:56:36+00:00
"{'username': 'CHarinathaRedd2', 'id': 811094617659576320, 'displayname': 'C.R.Harinatha Reddy', 'rawDescription': 'Independent Participate member of Human Rights', 'renderedDescription': 'Independent Participate member of Human Rights', 'descriptionLinks': None, 'verified': False, 'created': datetime.datetime(2016, 12, 20, 6, 23, 21, tzinfo=datetime.timezone.utc), 'followersCount': 12, 'friendsCount': 18, 'statusesCount': 1145, 'favouritesCount': 1598, 'listedCount': 2, 'mediaCount': 273, 'location': 'Hyderabad, India', 'protected': False, 'link': None, 'profileImageUrl': 'https://pbs.twimg.com/profile_images/863336131810742272/G0z1oEZa_normal.jpg', 'profileBannerUrl': 'https://pbs.twimg.com/profile_banners/811094617659576320/1484616769', 'label': None}",2017-07-08 04:00:18+00:00,We hate China&amp; boycott all goods of China https://t.co/9uRudaPaZp,"Hyderabad, India",False,12,2016-12-20 06:23:21+00:00
"{'username': 'HemantSirohi1', 'id': 630840253, 'displayname': '𝓱𝓮𝓶𝓪𝓷𝓽 𝓼𝓲𝓻𝓸𝓱𝓲', 'rawDescription': 'ꜰᴀʀᴍᴇʀ,\n\nᴩᴇᴛʀᴏʟᴇᴜᴍ ᴅᴇᴀʟᴇʀ,\n\nᴍᴇᴍʙᴇʀ,\nʀᴇꜱᴩᴏɴꜱɪʙʟᴇ,\nᴍᴇɴᴛᴏʀ,\n\nᴇᴍᴩᴏᴡᴇʀɪɴɢ ᴩᴇᴛʀᴏʟᴇᴜᴍ ᴅᴇᴀʟᴇʀꜱ ꜰᴏᴜɴᴅᴀᴛɪᴏɴ (ᴇᴅᴩꜰ®)\n\nᴠɪᴇᴡꜱ ᴩᴇʀꜱᴏɴᴀʟ\n\nʀᴛˢ ɴᴏᴛ ᴇɴᴅᴏʀꜱᴇᴅ', 'renderedDescription': 'ꜰᴀʀᴍᴇʀ,\n\nᴩᴇᴛʀᴏʟᴇᴜᴍ ᴅᴇᴀʟᴇʀ,\n\nᴍᴇᴍʙᴇʀ,\nʀᴇꜱᴩᴏɴꜱɪʙʟᴇ,\nᴍᴇɴᴛᴏʀ,\n\nᴇᴍᴩᴏᴡᴇʀɪɴɢ ᴩᴇᴛʀᴏʟᴇᴜᴍ ᴅᴇᴀʟᴇʀꜱ ꜰᴏᴜɴᴅᴀᴛɪᴏɴ (ᴇᴅᴩꜰ®)\n\nᴠɪᴇᴡꜱ ᴩᴇʀꜱᴏɴᴀʟ\n\nʀᴛˢ ɴᴏᴛ ᴇɴᴅᴏʀꜱᴇᴅ', 'descriptionLinks': None, 'verified': False, 'created': datetime.datetime(2012, 7, 9, 6, 5, 25, tzinfo=datetime.timezone.utc), 'followersCount': 1444, 'friendsCount': 221, 'statusesCount': 25707, 'favouritesCount': 554, 'listedCount': 10, 'mediaCount': 3401, 'location': 'India', 'protected': False, 'link': None, 'profileImageUrl': 'https://pbs.twimg.com/profile_images/1589931738041815040/9ji9ngfG_normal.jpg', 'profileBannerUrl': 'https://pbs.twimg.com/profile_banners/630840253/1509818129', 'label': None}",2017-07-07 17:36:41+00:00,"Every Indian Should Watch &amp; let's Join hands for Unity &amp; Boycott #Made_in_China 
Retweet &amp; Like
@narendramodi @consaff @empoweringdlrs https://t.co/wre4E9Pfto",India,False,1444,2012-07-09 06:05:25+00:00
"{'username': 'arabinda5121272', 'id': 778571027207098369, 'displayname': 'Arabinda', 'rawDescription': 'Business and Financial News Politicians and Pol Parties Only Passion to love my hindu Bharat.', 'renderedDescription': 'Business and Financial News Politicians and Pol Parties Only Passion to love my hindu Bharat.', 'descriptionLinks': None, 'verified': False, 'created': datetime.datetime(2016, 9, 21, 12, 26, 12, tzinfo=datetime.timezone.utc), 'followersCount': 34, 'friendsCount': 173, 'statusesCount': 7489, 'favouritesCount': 5219, 'listedCount': 0, 'mediaCount': 419, 'location': 'Jatni', 'protected': False, 'link': None, 'profileImageUrl': 'https://pbs.twimg.com/profile_images/915246865393651712/eEOi5JjH_normal.jpg', 'profileBannerUrl': 'https://pbs.twimg.com/profile_banners/778571027207098369/1496333814', 'label': None}",2017-07-07 17:03:53+00:00,Please boycott Chinese products or imposed heavy import taxes so Chinese can get BLOW from BHARAT. https://t.co/6isgdgYGlG,Jatni,False,34,2016-09-21 12:26:12+00:00
"{'username': 'ladha_sandeep', 'id': 1337273737, 'displayname': 'Sandeep Ladha', 'rawDescription': 'Proudly Indian, Professionally Chartered Accountant and Passionate for tommorrow.', 'renderedDescription': 'Proudly Indian, Professionally Chartered Accountant and Passionate for tommorrow.', 'descriptionLinks': None, 'verified': False, 'created': datetime.datetime(2013, 4, 8, 18, 9, 32, tzinfo=datetime.timezone.utc), 'followersCount': 642, 'friendsCount': 1388, 'statusesCount': 10276, 'favouritesCount': 25890, 'listedCount': 5, 'mediaCount': 223, 'location': 'Surat, Gujarat.', 'protected': False, 'link': {'text': 'facebook.com/ladha.sandeep', 'url': 'http://www.facebook.com/ladha.sandeep', 'tcourl': 'https://t.co/gOzl0SSAVs', 'indices': (0, 23)}, 'profileImageUrl': 'https://pbs.twimg.com/profile_images/1156560677563035648/54lJ0WtR_normal.jpg', 'profileBannerUrl': 'https://pbs.twimg.com/profile_banners/1337273737/1453401042', 'label': None}",2017-07-07 15:48:06+00:00,"@yadavtejashwi Shame on u. U getting tense on asking question. N u r dy cm of Bihar. Anti National channel, boycott. If u r true then face","Surat, Gujarat.",False,642,2013-04-08 18:09:32+00:00
"{'username': 'CHarinathaRedd2', 'id': 811094617659576320, 'displayname': 'C.R.Harinatha Reddy', 'rawDescription': 'Independent Participate member of Human Rights', 'renderedDescription': 'Independent Participate member of Human Rights', 'descriptionLinks': None, 'verified': False, 'created': datetime.datetime(2016, 12, 20, 6, 23, 21, tzinfo=datetime.timezone.utc), 'followersCount': 12, 'friendsCount': 18, 'statusesCount': 1145, 'favouritesCount': 1598, 'listedCount': 2, 'mediaCount': 273, 'location': 'Hyderabad, India', 'protected': False, 'link': None, 'profileImageUrl': 'https://pbs.twimg.com/profile_images/863336131810742272/G0z1oEZa_normal.jpg', 'profileBannerUrl': 'https://pbs.twimg.com/profile_banners/811094617659576320/1484616769', 'label': None}",2017-07-07 12:43:47+00:00,Boycott Chinese goods &amp; we hate China https://t.co/0liWb9UXwR,"Hyderabad, India",False,12,2016-12-20 06:23:21+00:00
"{'username': 'indianstocktip', 'id': 839739675069800448, 'displayname': 'Indian Stockmarket Tips', 'rawDescription': 'click my links to get tips on market.', 'renderedDescription': 'click my links to get tips on market.', 'descriptionLinks': None, 'verified': False, 'created': datetime.datetime(2017, 3, 9, 7, 28, 34, tzinfo=datetime.timezone.utc), 'followersCount': 2241, 'friendsCount': 1226, 'statusesCount': 3822, 'favouritesCount': 525, 'listedCount': 18, 'mediaCount': 64, 'location': 'India', 'protected': False, 'link': None, 'profileImageUrl': 'https://pbs.twimg.com/profile_images/1043380061804654592/TVT_eZMD_normal.jpg', 'profileBannerUrl': 'https://pbs.twimg.com/profile_banners/839739675069800448/1503585108', 'label': None}",2017-07-07 09:55:14+00:00,"#GST extended to #JammuAndKashmir  amidst opposition boycott
#LatestNews #GSTForNewIndia #GST_दिल्लीसम्बोधन #GSTN https://t.co/SHt3b5czpt",India,False,2241,2017-03-09 07:28:34+00:00
"{'username': 'SecularBuffalo', 'id': 251691973, 'displayname': 'Secular Buffalo 🐃', 'rawDescription': 'pagal hai kya,\nbio dekh rha hai tu,\nNovak Djokovic is love ❤️\nVET 🐃🐄', 'renderedDescription': 'pagal hai kya,\nbio dekh rha hai tu,\nNovak Djokovic is love ❤️\nVET 🐃🐄', 'descriptionLinks': None, 'verified': False, 'created': datetime.datetime(2011, 2, 13, 17, 20, 4, tzinfo=datetime.timezone.utc), 'followersCount': 3060, 'friendsCount': 844, 'statusesCount': 197683, 'favouritesCount': 146381, 'listedCount': 54, 'mediaCount': 9416, 'location': 'Nabarangpur,Odisha ', 'protected': False, 'link': None, 'profileImageUrl': 'https://pbs.twimg.com/profile_images/1248196810692161537/43rJU6ch_normal.jpg', 'profileBannerUrl': 'https://pbs.twimg.com/profile_banners/251691973/1602315463', 'label': None}",2017-07-07 08:59:27+00:00,"how to boycott ,VIVO and OPPO have penetrated rural India https://t.co/fuSDRGsmtd","Nabarangpur,Odisha ",False,3060,2011-02-13 17:20:04+00:00
"{'username': 'sampath_s', 'id': 16694043, 'displayname': 'sripath PhD', 'rawDescription': '', 'renderedDescription': '', 'descriptionLinks': None, 'verified': False, 'created': datetime.datetime(2008, 10, 11, 7, 22, 10, tzinfo=datetime.timezone.utc), 'followersCount': 231, 'friendsCount': 336, 'statusesCount': 56588, 'favouritesCount': 23194, 'listedCount': 31, 'mediaCount': 66, 'location': '', 'protected': False, 'link': None, 'profileImageUrl': 'https://pbs.twimg.com/profile_images/1553977546324180992/jnHwETgt_normal.jpg', 'profileBannerUrl': 'https://pbs.twimg.com/profile_banners/16694043/1555513664', 'label': None}",2017-07-07 06:30:55+00:00,"#BoycottChineseProducts
Right time to start to boycott products from chinese companies. Next traders who do bulk container load import.",,False,231,2008-10-11 07:22:10+00:00
"{'username': 'BKVijayasimha', 'id': 860103897188356097, 'displayname': 'National Vikas Party.', 'rawDescription': 'Welcome to volunteer, join us for the Political platform New Organized National Vikas Party, area wise States leaders of India, contact convener -09493184364.', 'renderedDescription': 'Welcome to volunteer, join us for the Political platform New Organized National Vikas Party, area wise States leaders of India, contact convener -09493184364.', 'descriptionLinks': None, 'verified': False, 'created': datetime.datetime(2017, 5, 4, 12, 8, 43, tzinfo=datetime.timezone.utc), 'followersCount': 5, 'friendsCount': 30, 'statusesCount': 486, 'favouritesCount': 28, 'listedCount': 0, 'mediaCount': 412, 'location': 'Hyderabad, India. ', 'protected': False, 'link': {'text': 'nvp.com', 'url': 'http://nvp.com', 'tcourl': 'https://t.co/VqKqVyU7Wb', 'indices': (0, 23)}, 'profileImageUrl': 'https://pbs.twimg.com/profile_images/865944371987849217/sG_L-OD9_normal.jpg', 'profileBannerUrl': 'https://pbs.twimg.com/profile_banners/860103897188356097/1495292599', 'label': None}",2017-07-07 05:40:52+00:00,"Hello Indians, Boycott Chinese products, people's Voice, National Vikas Party, https://t.co/1r9Y4Gqr8L","Hyderabad, India. ",False,5,2017-05-04 12:08:43+00:00
